"Monstre","Monster","Element","Element 2","Weakness Element ","Weakness Element 2","Weakness part","hp","Image","Weakness Element 3","Description",
"seltas","seltas","None",0,"Thunder","Fire","Abdominal",2000,"https://static.wikia.nocookie.net/mogapedia/images/a/a5/400px-MH4-Seltas_Render_001-1-.png/revision/latest?cb=20141011071322&path-prefix=fr",0,"Neopterons that use swift aerial movements to attack invaders on the ground. The sharp appendages on their heads can make their lunging attacks quite dangerous, though they sometimes overshoot their targets and slam into the ground. ",
"seltas du desert","desert seltas","None",0,"Ice","Thunder","Belly",2500,"https://static.wikia.nocookie.net/mogapedia/images/6/68/MH4U-Seltas_Subspecies_Render_001.png/revision/latest/scale-to-width-down/400?cb=20140924175345&path-prefix=fr",0,"A mid-sized Neopteron whose forked horns and broad foreleg- attack range set it apart from its more common cousins. Desert Seltas have also been known to burrow freely through the ground. ",
"seregios","seregios","None",0,"Thunder","Ice","Abdominal",4200,"https://static.wikia.nocookie.net/mogapedia/images/f/f5/MHRS_-_Seregios_Render_001.png/revision/latest/scale-to-width-down/400?cb=20220510144053&path-prefix=fr ",0,"An elusive breed of wyvern only rarely spotted throughout the lands in recent years. Known for its ability to launch razor-edge scales at prey, and for its ability to stand those scales on end to strike at any who threaten it. ",
"shagaru magala","shagaru magala","None",0,"Dragon","Fire","Head",5500,"https://static.wikia.nocookie.net/mogapedia/images/8/82/MHRS-Shagaru_magala_Render.png/revision/latest/scale-to-width-down/500?cb=20220628134520&path-prefix=fr",0,"The distinctive radiant light of the mature Gore Magala has been seen in the Sanctuary of Heaven's Mount. Some believe Shagaru Magala was the ""foul wind that withered a mountain,"" a calamity spoken of in ancient texts. ",
"teostra","teostra","Fire","Dragon","Dragon","Water","Head",5300,"https://static.wikia.nocookie.net/mogapedia/images/2/29/MHRise-Teostra_Render_001.png/revision/latest/scale-to-width-down/400?cb=20210427154531&path-prefix=fr",0,"Brutal elder dragons clothed in flame that spit blazing fire. Teostra are of such a fierce and deadly nature that the Guild keeps track of their movements whenever possible. ",
"tetsucabra","tetsucabra","None",0,"Water","Thunder","Tail (inflated)",4000,"https://static.wikia.nocookie.net/mogapedia/images/0/08/MH4-Tetsucabra_Render_001.png/revision/latest/scale-to-width-down/400?cb=20140822083237&path-prefix=fr",0,"Amphibians with unique jaws and tusks that they use to sift through rocks for prey. They use their powerful hind legs to traverse steep terrain. The tail supports movement, but can become vulnerable with exertion. ",
"tetsucabra feroce","berserk tetsucabra","None",0,"Ice","Thunder","Tail (inflated)",4200,"https://static.wikia.nocookie.net/mogapedia/images/7/78/MH4U-Tetsucabra_Subspecies_Render_001.png/revision/latest/scale-to-width-down/400?cb=20141115222843&path-prefix=fr",0,"An amphibious monster known for its distinctive markings resembling a painted face. These beasts dig up and hurl boulders in the same way as a standard Tetsucabra does, but the stones thrown by this Berserk variety explode upon impact. ",
"tigrex","tigrex","None",0,"Thunder","Dragon","Head",5000,"https://static.wikia.nocookie.net/mogapedia/images/2/21/MHRise-Tigrex_Render_001.png/revision/latest/scale-to-width-down/1000?cb=20210107151525&path-prefix=fr",0,"Flying wyverns whose primitive origins are obvious. Prone to violence, they display incredible ferocity with their claws, jaws, and developed limbs. They inhabit a wide area, and have been spotted as far off as the Frozen Seaway. ",
"tigrex berserk","brute tigrex","None",0,"Water",0,"Head",4500,"https://static.wikia.nocookie.net/mogapedia/images/2/2f/MHWI-Brute_Tigrex_Render_001.png/revision/latest/scale-to-width-down/400?cb=20200219210757&path-prefix=fr",0,"A subspecies of Tigrex, these beasts are as brutal as they are ravenous. They prefer volcanic regions, but can be found in a range of areas. Their howls are even more piercing than standard Tigrex roars and send shockwaves far and wide. ",
"tigrex magma","molten tigrex","None",0,"Water","Ice","Tail",5000,"https://static.wikia.nocookie.net/mogapedia/images/6/6f/MH4-Tigrex_Rare_Species_Screenshot_003.jpg/revision/latest/scale-to-width-down/350?cb=20140927131202&path-prefix=fr",0,"A rare Tigrex variant theorized to exist after the discovery of claw marks and prints far larger than those of an ordinary Tigrex. With no confirmed first-hand sightings, its existence remains a matter of debate among hunters. ",
"ukanlos","ukanlos","Ice",0,"Fire","Thunder","Head",7000,"https://static.wikia.nocookie.net/mogapedia/images/7/75/MH4U-Ukanlos.png/revision/latest/scale-to-width-down/400?cb=20160812171011&path-prefix=fr",0,"An enigmatic dragon sighted only deep within the most remote extremes. Its jaws are capable of crushing ice and rock alike. The natives of one region claim its appearance mirrors that of the white god of their legends. ",
"velocidrome","velocidrome","None",0,"Thunder","Ice","Head",2000,"https://static.wikia.nocookie.net/mogapedia/images/7/71/MH4-Velocidrome_and_Velociprey_Render_001.png/revision/latest/scale-to-width-down/400?cb=20140828110519&path-prefix=fr",0,"Alpha monsters that lead Velociprey packs. Larger than their brothers and with a more prominent crest, Velocidrome use their strong hind legs to leap at prey, pinning them with sharp claws before calling for others. ",
"yian garuga","yian garuga","Fire",0,"Water",0,"Head",4200,"https://static.wikia.nocookie.net/mogapedia/images/7/73/MHWI-Yian_Garuga_Render_001.png/revision/latest?cb=20200208140534&path-prefix=fr",0,"A close relative of the Yian Kut-Ku known for its hard black shell and tufts of white mane. These clever monsters are known to avoid traps and use their poisonous tail to deadly effect"," they are not to be taken lightly. "
"yian kut-ku","yian kut-ku","Fire",0,"Thunder","Ice","Wing",3800,"https://static.wikia.nocookie.net/mogapedia/images/c/ce/MH4-Yian_Kut-Ku_and_Konchu_Render_001.png/revision/latest/scale-to-width-down/357?cb=20150110124837&path-prefix=fr",0,"A bird wyvern with a huge beak and large ears that splay open when it is angered. Due to its sensitive hearing it dislikes loud noises. It is smaller but faster than other wyverns. ",
"yian kut-ku bleu","blue yian kut-ku","Fire",0,"Water","Thunder","Belly",4000,"https://static.wikia.nocookie.net/mogapedia/images/7/78/MH4-Blue_Yian_Kut-Ku_Render_001.png/revision/latest/scale-to-width-down/400?cb=20140913141529&path-prefix=fr",0,"A Yian Kut-Ku variant protected by a blue carapace. They share the same weakness to loud noises that ordinary Yian Kut-Ku have, but when angered, they display significantly greater physical strength. ",
"zamtrios","zamtrios","Water","Ice","Thunder","Fire","Belly (inflated)",5200,"https://static.wikia.nocookie.net/mogapedia/images/8/89/MH4-Zamtrios_Render_001.png/revision/latest/scale-to-width-down/400?cb=20140823095615&path-prefix=fr",0,"Amphibians that strike from frozen waters, using the cold to stun their prey. They secrete a special liquid that both coats their own body with icy armor and freezes any nearby foes. Frogs are their favorite food. ",
"zamtrios tigre","tigerstripe zamtrios","Water",0,"Ice","Thunder","Belly (inflated)",5000,"https://static.wikia.nocookie.net/mogapedia/images/e/e9/MH4U-Tigerstripe_Zamtrios_Render_001.png/revision/latest/scale-to-width-down/400?cb=20140924162213&path-prefix=fr",0,"Unlike its standard counterpart, this distinctively-striped Zamtrios subspecies dwells primarily in desert climes, and can employ its ability to expand and contract its body even while in motion, making it an even more formidable adversary. ",
"zinogre","zinogre","Thunder",0,"Ice","Water","Head",5300,"https://static.wikia.nocookie.net/mogapedia/images/3/37/MHRise-Zinogre_Render_001.png/revision/latest/scale-to-width-down/400?cb=20210308144449&path-prefix=fr",0,"Fanged wyverns whose bodies are streaked with electricity. Sharp claws and strong limbs allow them to thrive in mountainous terrain. During hunts, they gather numerous Thunderbugs to boost their power and enter a supercharged state. ",
"zinogre stygien","stygian zinogre","Dragon",0,"Thunder","Water","Head",5100,"https://static.wikia.nocookie.net/mogapedia/images/e/ee/MHWI-Stygian_Zinogre_Render_001.png/revision/latest/scale-to-width-down/400?cb=20191129110550&path-prefix=fr",0,"A subspecies of Zinogre with a jet-black body. It gathers bugs that eat Dragonfell Berries and uses their Dragon Element energy to boost its own power. Perhaps this is why it can survive in scorching heat or freezing cold. ",
